{"schema_version":"3.0.0","case_id":"C173fc82e7195049f","judge_id":"judge_a","rubric_version":"3.0.0-rc.1","passage_function_interpretation":"phenomenon_motivation","category_results":{"fidelity":{"applicability":"required","assessment_status":"assessed","score":5,"reason":"The passage moves the decision until after the transfer mechanism is fully observed, replacing the supplied pre-knowledge timing and information set.","evidence_spans":["after whether the practice's mechanism survives the new context has been fully observed"]},"managerial_framing":{"applicability":"required","assessment_status":"assessed","score":13,"reason":"The actor, choice, mechanism, and imitation-versus-fit tension remain visible, but the altered timing removes the central decision under uncertainty.","evidence_spans":["chooses whether and how to adapt the practice","has been fully observed"]},"scholarly_positioning":{"applicability":"optional","assessment_status":"assessed","score":18,"reason":"The mechanism-based shift from copying to enabling routines remains specific and bounded.","evidence_spans":["shifts attention from copying practices to preserving their enabling mechanism"]},"evidence_discipline":{"applicability":"required","assessment_status":"assessed","score":14,"reason":"The causal scope is explicitly bounded, although that discipline does not repair the changed decision-time information.","evidence_spans":["does not establish universal causality"]},"prose_clarity":{"applicability":"required","assessment_status":"assessed","score":9,"reason":"The prose is clear, but its opening makes a materially different decision sequence sound coherent.","evidence_spans":["after whether the practice's mechanism survives the new context has been fully observed"]}},"hard_failures":["timing_gate_failure","information_gate_failure","undeclared_model_change"],"normalized_score":59,"capped_score":59,"overall_status":"fail","overall_reason":"Observing the transfer mechanism before choosing adaptation changes both timing and information, so the uncertainty central to the supplied problem disappears.","higher_than_both_justification":null}
