{"schema_version":"3.0.0","case_id":"C754f18d8446f55e3","judge_id":"judge_b","rubric_version":"3.0.0-rc.1","passage_function_interpretation":"business_problem","category_results":{"fidelity":{"applicability":"required","assessment_status":"assessed","score":15,"reason":"The operative choice-to-outcome mechanism is explicitly omitted.","evidence_spans":["does not connect the choice to the outcome"]},"managerial_framing":{"applicability":"required","assessment_status":"assessed","score":16,"reason":"The actor, decision, and trade-off appear, but the operational pathway is missing.","evidence_spans":["A stricter threshold blocks more harmful accounts but rejects more benign participants"]},"scholarly_positioning":{"applicability":"optional","assessment_status":"assessed","score":15,"reason":"It frames a selective-rule question without positioning it against prior work.","evidence_spans":["when a common score rule should become more selective"]},"evidence_discipline":{"applicability":"required","assessment_status":"assessed","score":15,"reason":"The result is appropriately bounded to assumptions rather than field effectiveness.","evidence_spans":["conditional on the assumed score distributions and does not establish field effectiveness"]},"prose_clarity":{"applicability":"required","assessment_status":"assessed","score":9,"reason":"The prose is otherwise economical and readable.","evidence_spans":["The stated objective is to maximize expected platform value"]}},"hard_failures":[],"normalized_score":70,"capped_score":70,"overall_status":"fail","overall_reason":"The required fidelity category falls below its minimum because the mechanism is absent.","higher_than_both_justification":null}
