{
  "schema_version": "3.0.0",
  "case_id": "C3f96ac0372bacbd5",
  "judge_id": "judge_a",
  "rubric_version": "3.0.0-rc.1",
  "passage_function_interpretation": "model_setting",
  "category_results": {
    "fidelity": {
      "applicability": "required",
      "assessment_status": "assessed",
      "score": 8,
      "reason": "An outside observer who cannot dispatch replaces the dispatch planner.",
      "evidence_spans": [
        "an outside observer who cannot make the decision selects a feasible routing plan"
      ]
    },
    "managerial_framing": {
      "applicability": "optional",
      "assessment_status": "assessed",
      "score": 22,
      "reason": "The search-quality versus deadline trade-off remains operationally concrete.",
      "evidence_spans": [
        "Longer search may improve cost but can make the certified plan operationally late."
      ]
    },
    "scholarly_positioning": {
      "applicability": "not_applicable",
      "assessment_status": "not_applicable",
      "score": null,
      "reason": "Scholarly positioning is not part of the assessed function of this model setting passage.",
      "evidence_spans": []
    },
    "evidence_discipline": {
      "applicability": "required",
      "assessment_status": "assessed",
      "score": 14,
      "reason": "The passage bounds computational value to tested instances and hardware.",
      "evidence_spans": [
        "Computational value is limited to tested instances, hardware, and the specified deadline."
      ]
    },
    "prose_clarity": {
      "applicability": "required",
      "assessment_status": "assessed",
      "score": 9,
      "reason": "The prose is compact and clear.",
      "evidence_spans": [
        "The study connects solution quality and certificate timing to the actual release decision."
      ]
    }
  },
  "hard_failures": [
    "actor_gate_failure"
  ],
  "normalized_score": 66.25,
  "capped_score": 66.25,
  "overall_status": "fail",
  "overall_reason": "A hard fidelity or evidence failure makes the passage fail despite strengths elsewhere.",
  "higher_than_both_justification": null
}
