{"schema_version":"3.0.0","case_id":"Ce7f9cb824fe9fe95","judge_id":"judge_a","rubric_version":"3.0.0-rc.1","passage_function_interpretation":"contribution","category_results":{"fidelity":{"applicability":"required","assessment_status":"assessed","score":10,"reason":"A noncontrolling observer replaces the senior team.","evidence_spans":["an outside observer who cannot make the decision chooses how much discretion to delegate"]},"managerial_framing":{"applicability":"optional","assessment_status":"assessed","score":18,"reason":"The adaptation-oversight tension is clear, but decision authority is invalid.","evidence_spans":["Greater discretion supports adaptation but weakens consistency and oversight."]},"scholarly_positioning":{"applicability":"required","assessment_status":"assessed","score":16,"reason":"The mechanism-based counterposition is substantive.","evidence_spans":["rather than as a generic best practice"]},"evidence_discipline":{"applicability":"required","assessment_status":"assessed","score":10,"reason":"The theory is bounded, but actor control is inconsistent.","evidence_spans":["does not imply that decentralization always improves performance"]},"prose_clarity":{"applicability":"required","assessment_status":"assessed","score":8,"reason":"The contribution is readable despite the actor contradiction.","evidence_spans":["partial observability"]}},"hard_failures":["actor_gate_failure"],"normalized_score":62,"capped_score":62,"overall_status":"fail","overall_reason":"A noncontrolling observer is substituted for the responsible senior team.","higher_than_both_justification":null}
