{"schema_version":"3.0.0","case_id":"C309a0070c1483d7f","judge_id":"judge_b","rubric_version":"3.0.0-rc.1","passage_function_interpretation":"business_problem","category_results":{"fidelity":{"applicability":"required","assessment_status":"assessed","score":0,"reason":"It gives the manager future outcomes and latent type despite the stated admission-time constraint.","evidence_spans":["the future realized outcome, and any latent type"]},"managerial_framing":{"applicability":"required","assessment_status":"assessed","score":25,"reason":"The decision, stakes, mechanism, and trade-off are concrete.","evidence_spans":["A stricter threshold blocks more harmful accounts but rejects more benign participants"]},"scholarly_positioning":{"applicability":"optional","assessment_status":"assessed","score":15,"reason":"It identifies a bounded rule question without a developed literature relationship.","evidence_spans":["when a common score rule should become more selective"]},"evidence_discipline":{"applicability":"required","assessment_status":"assessed","score":15,"reason":"The information change is explicit rather than concealed, and the result remains conditional.","evidence_spans":["conditional on the assumed score distributions"]},"prose_clarity":{"applicability":"required","assessment_status":"assessed","score":9,"reason":"The passage is readable despite the deliberate information inconsistency.","evidence_spans":["The threshold changes false rejection and harmful admission rates"]}},"hard_failures":["information_gate_failure"],"normalized_score":64,"capped_score":64,"overall_status":"fail","overall_reason":"It uses information unavailable when the threshold is set.","higher_than_both_justification":null}
