{"schema_version":"3.0.0","case_id":"Cb032664168e41d25","judge_id":"judge_b","rubric_version":"3.0.0-rc.1","passage_function_interpretation":"research_opportunity","category_results":{"fidelity":{"applicability":"required","assessment_status":"assessed","score":24,"reason":"The policy and privacy setting are preserved, but the decision-to-outcome link is expressly missing.","evidence_spans":["does not connect the choice to the outcome"]},"managerial_framing":{"applicability":"required","assessment_status":"assessed","score":19,"reason":"The harm-attention trade-off is concrete but the operational pathway is incomplete.","evidence_spans":["consumes scarce reviewer attention"]},"scholarly_positioning":{"applicability":"required","assessment_status":"assessed","score":15,"reason":"It asks a bounded question without stating a prior-literature relationship.","evidence_spans":["how privacy limits alter the value"]},"evidence_discipline":{"applicability":"required","assessment_status":"assessed","score":15,"reason":"The welfare and data-access boundaries are explicit.","evidence_spans":["does not treat revenue as welfare"]},"prose_clarity":{"applicability":"required","assessment_status":"assessed","score":8,"reason":"It is readable but includes a vague missing-link assertion.","evidence_spans":["several relevant operational details"]}},"hard_failures":[],"normalized_score":81,"capped_score":81,"overall_status":"pass","overall_reason":"The research opportunity is bounded and usable, though its mechanism is incomplete.","higher_than_both_justification":null}
