{"schema_version":"3.0.0","case_id":"C00059427eb898128","judge_id":"judge_a","rubric_version":"3.0.0-rc.1","passage_function_interpretation":"model_setting","category_results":{"fidelity":{"applicability":"required","assessment_status":"assessed","score":8,"reason":"First-stage capacity is moved until after future market demand is fully observed, contradicting the supplied advance decision.","evidence_spans":["after future demand by market has been fully observed","chooses first-stage capacity"]},"managerial_framing":{"applicability":"required","assessment_status":"assessed","score":17,"reason":"The capacity-recourse trade-off remains clear, but it no longer describes an advance decision under uncertainty.","evidence_spans":["More advance capacity is expensive but reduces shortage and emergency recourse exposure.","after future demand by market has been fully observed"]},"scholarly_positioning":{"applicability":"optional","assessment_status":"assessed","score":14,"reason":"The recourse-substitution insight is bounded, but the timing change invalidates its uncertainty interpretation.","evidence_spans":["rather than perfect demand foresight","when flexible recourse substitutes for advance capacity"]},"evidence_discipline":{"applicability":"required","assessment_status":"assessed","score":10,"reason":"The scope boundary is stated, but post-observation first-stage capacity is presented without reconciling the contradiction.","evidence_spans":["after future demand by market has been fully observed","rather than perfect demand foresight"]},"prose_clarity":{"applicability":"required","assessment_status":"assessed","score":8,"reason":"The prose is readable, although the opening timing contradicts the two-stage structure.","evidence_spans":["First-stage capacity changes the feasible and costly adjustments"]}},"hard_failures":["timing_gate_failure","information_gate_failure"],"normalized_score":57,"capped_score":57,"overall_status":"fail","overall_reason":"The passage converts advance capacity under uncertainty into a decision made with realized demand.","higher_than_both_justification":null}
