{"schema_version":"3.0.0","case_id":"C96c0e4eec48f1793","judge_id":"judge_b","rubric_version":"3.0.0-rc.1","passage_function_interpretation":"model_setting","category_results":{"fidelity":{"applicability":"required","assessment_status":"assessed","score":30,"reason":"The two-stage capacity and recourse setting remains faithful to the supplied facts.","evidence_spans":["chooses first-stage capacity and a recourse policy","recourse actions occur only after demand is observed"]},"managerial_framing":{"applicability":"required","assessment_status":"assessed","score":13,"reason":"The passage identifies the decision but leaves the decision-to-outcome mechanism and trade-off unspecified.","evidence_spans":["their relationship is not specified","competing considerations that require further analysis"]},"scholarly_positioning":{"applicability":"not_applicable","assessment_status":"not_applicable","score":null,"reason":"This passage functions as a model setting, not a scholarly-positioning claim.","evidence_spans":[]},"evidence_discipline":{"applicability":"required","assessment_status":"assessed","score":15,"reason":"It appropriately leaves the claim's scope unestablished rather than claiming results.","evidence_spans":["The scope of the resulting claim remains to be established"]},"prose_clarity":{"applicability":"required","assessment_status":"assessed","score":9,"reason":"The passage is readable but uses generic placeholder phrasing.","evidence_spans":["Several operational considerations"]}},"hard_failures":[],"normalized_score":83.75,"capped_score":83.75,"overall_status":"fail","overall_reason":"The required managerial-framing score is below minimum because the operational pathway is not specified.","higher_than_both_justification":null}
