{"schema_version":"3.0.0","case_id":"C4c488fa726b5ef69","judge_id":"judge_b","rubric_version":"3.0.0-rc.1","passage_function_interpretation":"contribution","category_results":{"fidelity":{"applicability":"required","assessment_status":"assessed","score":30,"reason":"The actor, observability limit, delegation choice, and trade-off are preserved.","evidence_spans":["headquarters cannot directly observe every local motive or consequence","Greater discretion supports adaptation but weakens consistency and oversight"]},"managerial_framing":{"applicability":"optional","assessment_status":"assessed","score":25,"reason":"It gives a concrete senior-team decision and operational tension.","evidence_spans":["chooses how much discretion to delegate"]},"scholarly_positioning":{"applicability":"required","assessment_status":"assessed","score":5,"reason":"Novelty is claimed solely because the topic has not appeared in this context.","evidence_spans":["has not previously been studied in this particular context"]},"evidence_discipline":{"applicability":"required","assessment_status":"assessed","score":15,"reason":"The theory boundary and non-universality are explicit.","evidence_spans":["does not imply that decentralization always improves performance"]},"prose_clarity":{"applicability":"required","assessment_status":"assessed","score":9,"reason":"The prose is economical and intelligible.","evidence_spans":["Delegation improves local fit while common rules limit coordination and agency losses"]}},"hard_failures":[],"normalized_score":84,"capped_score":84,"overall_status":"fail","overall_reason":"The required scholarly-positioning score is below its minimum because the contribution is context-only novelty.","higher_than_both_justification":null}
