{
  "schema_version": "3.0.0",
  "case_id": "Cce430e24c6c1afe5",
  "judge_id": "judge_a",
  "rubric_version": "3.0.0-rc.1",
  "passage_function_interpretation": "business_problem",
  "category_results": {
    "fidelity": {
      "applicability": "required",
      "assessment_status": "assessed",
      "score": 8,
      "reason": "An outside observer who cannot allocate replaces the regional inventory planner.",
      "evidence_spans": [
        "an outside observer who cannot make the decision allocates a fixed stock across service zones"
      ]
    },
    "managerial_framing": {
      "applicability": "required",
      "assessment_status": "assessed",
      "score": 24,
      "reason": "The allocation mechanism and concentration-versus-coverage trade-off are otherwise concrete.",
      "evidence_spans": [
        "Concentration pools scarce stock, while broader coverage protects more zones."
      ]
    },
    "scholarly_positioning": {
      "applicability": "not_applicable",
      "assessment_status": "not_applicable",
      "score": null,
      "reason": "Scholarly positioning is not part of the assessed function of this business problem passage.",
      "evidence_spans": []
    },
    "evidence_discipline": {
      "applicability": "required",
      "assessment_status": "assessed",
      "score": 15,
      "reason": "The passage clearly distinguishes the model from live deployment.",
      "evidence_spans": [
        "The claim concerns one-period allocation under the supplied distributions, not live deployment."
      ]
    },
    "prose_clarity": {
      "applicability": "required",
      "assessment_status": "assessed",
      "score": 10,
      "reason": "The prose is compact and usable.",
      "evidence_spans": [
        "The study clarifies when pre-positioning coverage is worth the loss of inventory concentration."
      ]
    }
  },
  "hard_failures": [
    "actor_gate_failure"
  ],
  "normalized_score": 71.25,
  "capped_score": 69.0,
  "overall_status": "fail",
  "overall_reason": "A hard fidelity or evidence failure makes the passage fail despite strengths elsewhere.",
  "higher_than_both_justification": null
}
