{"schema_version":"3.0.0","case_id":"C7526d00647a3e5f0","judge_id":"judge_b","rubric_version":"3.0.0-rc.1","passage_function_interpretation":"business_problem","category_results":{"fidelity":{"applicability":"required","assessment_status":"assessed","score":30,"reason":"It retains the score-threshold choice, latent-type uncertainty, objective, and admission-error setting.","evidence_spans":["true account type is not observed at admission"]},"managerial_framing":{"applicability":"required","assessment_status":"assessed","score":13,"reason":"The choice is identified, but the supplied error-rate mechanism and strictness trade-off are replaced with generic wording.","evidence_spans":["their relationship is not specified"]},"scholarly_positioning":{"applicability":"required","assessment_status":"assessed","score":16,"reason":"The final implication is focused but does not state a prior-knowledge relationship.","evidence_spans":["when a common score rule should become more selective"]},"evidence_discipline":{"applicability":"required","assessment_status":"assessed","score":13,"reason":"The claim is cautiously left open, but its mechanism is not traceable in the prose.","evidence_spans":["scope of the resulting claim remains to be established"]},"prose_clarity":{"applicability":"required","assessment_status":"assessed","score":7,"reason":"Generic importance language reduces economy and usefulness.","evidence_spans":["The decision is important"]}},"hard_failures":[],"normalized_score":79,"capped_score":79,"overall_status":"fail","overall_reason":"The business problem omits its operational mechanism and falls below the managerial-framing minimum.","higher_than_both_justification":null}
