{"schema_version":"3.0.0","case_id":"Cfc8633b1c040eaee","judge_id":"judge_b","rubric_version":"3.0.0-rc.1","passage_function_interpretation":"contribution","category_results":{"fidelity":{"applicability":"required","assessment_status":"assessed","score":15,"reason":"The passage explicitly omits the choice-to-outcome mechanism.","evidence_spans":["does not connect the choice to the outcome"]},"managerial_framing":{"applicability":"optional","assessment_status":"assessed","score":16,"reason":"The delegation trade-off is clear but its operating pathway is missing.","evidence_spans":["Greater discretion supports adaptation but weakens consistency and oversight"]},"scholarly_positioning":{"applicability":"required","assessment_status":"assessed","score":18,"reason":"It states a bounded mechanism-based contribution rather than a generic best practice.","evidence_spans":["response to joint adaptation and observability conditions rather than as a generic best practice"]},"evidence_discipline":{"applicability":"required","assessment_status":"assessed","score":15,"reason":"The theory limit is explicit and it avoids performance claims.","evidence_spans":["does not imply that decentralization always improves performance"]},"prose_clarity":{"applicability":"required","assessment_status":"assessed","score":9,"reason":"The text remains direct despite the missing mechanism.","evidence_spans":["a multiunit firm's senior team chooses how much discretion to delegate"]}},"hard_failures":[],"normalized_score":73,"capped_score":73,"overall_status":"fail","overall_reason":"The required fidelity score is below its minimum because the outcome pathway is omitted.","higher_than_both_justification":null}
