{"schema_version":"3.0.0","case_id":"C426b0c30d493ade1","judge_id":"judge_a","rubric_version":"3.0.0-rc.1","passage_function_interpretation":"model_setting","category_results":{"fidelity":{"applicability":"required","assessment_status":"assessed","score":10,"reason":"Timing, information, recourse, and objective are preserved, but a noncontrolling outside observer replaces the capacity planner.","evidence_spans":["an outside observer who cannot make the decision chooses first-stage capacity and a recourse policy","before uncertain demand is realized"]},"managerial_framing":{"applicability":"required","assessment_status":"assessed","score":15,"reason":"The capacity-recourse trade-off is specific, but the responsible managerial actor is invalidated.","evidence_spans":["More advance capacity is expensive but reduces shortage and emergency recourse exposure.","outside observer who cannot make the decision"]},"scholarly_positioning":{"applicability":"optional","assessment_status":"assessed","score":14,"reason":"It offers a bounded recourse-substitution insight without explicit prior-literature positioning.","evidence_spans":["depends on the modeled distribution and recourse set","when flexible recourse substitutes for advance capacity"]},"evidence_discipline":{"applicability":"required","assessment_status":"assessed","score":10,"reason":"The distributional scope is bounded, but the observer-as-planner statement is materially inconsistent.","evidence_spans":["rather than perfect demand foresight","outside observer who cannot make the decision"]},"prose_clarity":{"applicability":"required","assessment_status":"assessed","score":8,"reason":"The setting is readable apart from the actor contradiction.","evidence_spans":["First-stage capacity changes the feasible and costly adjustments available after demand realization."]}},"hard_failures":["actor_gate_failure"],"normalized_score":57,"capped_score":57,"overall_status":"fail","overall_reason":"The capacity setting is otherwise coherent, but a noncontrolling observer is made the decision maker.","higher_than_both_justification":null}
