{"schema_version":"3.0.0","case_id":"C002c1aa2f5b030f6","judge_id":"judge_b","rubric_version":"3.0.0-rc.1","passage_function_interpretation":"business_problem","category_results":{"fidelity":{"applicability":"required","assessment_status":"assessed","score":30,"reason":"The allocation timing, information, objective, immobility constraint, and coverage-concentration mechanism are retained.","evidence_spans":["stock cannot be transferred after orders arrive"]},"managerial_framing":{"applicability":"required","assessment_status":"assessed","score":23,"reason":"It presents a concrete planner choice and an explicit coverage-versus-pooling trade-off.","evidence_spans":["Concentration pools scarce stock, while broader coverage protects more zones"]},"scholarly_positioning":{"applicability":"required","assessment_status":"assessed","score":16,"reason":"The closing claim gives a bounded analytical contribution but no explicit prior-literature relationship.","evidence_spans":["clarifies when pre-positioning coverage is worth"]},"evidence_discipline":{"applicability":"required","assessment_status":"assessed","score":0,"reason":"It asserts universal transformation, guaranteed profit, and applicability in every market without supplied evidence.","evidence_spans":["guarantee profit growth, and work in every market"]},"prose_clarity":{"applicability":"required","assessment_status":"assessed","score":8,"reason":"The operational setup is readable, but the inflated claim disrupts its disciplined tone.","evidence_spans":["The approach will transform the industry"]}},"hard_failures":["unsupported_causal_claim"],"normalized_score":77,"capped_score":69,"overall_status":"fail","overall_reason":"Unsupported universal performance claims trigger a hard failure.","higher_than_both_justification":null}
