{"schema_version":"3.0.0","case_id":"C35c00438dc272cb4","judge_id":"judge_b","rubric_version":"3.0.0-rc.1","passage_function_interpretation":"business_problem","category_results":{"fidelity":{"applicability":"required","assessment_status":"assessed","score":4,"reason":"The allocation decision is moved until after regional orders are fully observed instead of before the allocation cutoff.","evidence_spans":["after regional orders has been fully observed","before the weekly allocation cutoff"]},"managerial_framing":{"applicability":"required","assessment_status":"assessed","score":25,"reason":"It otherwise provides a clear allocation choice, service mechanism, and concentration-versus-coverage trade-off.","evidence_spans":["Concentration pools scarce stock, while broader coverage protects more zones"]},"scholarly_positioning":{"applicability":"not_applicable","assessment_status":"not_applicable","score":null,"reason":"This passage functions as a business problem, not a scholarly-positioning claim.","evidence_spans":[]},"evidence_discipline":{"applicability":"required","assessment_status":"assessed","score":15,"reason":"The claim is limited to one-period supplied distributions and not live deployment.","evidence_spans":["one-period allocation under the supplied distributions, not live deployment"]},"prose_clarity":{"applicability":"required","assessment_status":"assessed","score":10,"reason":"The prose is concise and well organized.","evidence_spans":["Pre-positioning determines which realized orders can be served in each zone"]}},"hard_failures":["timing_gate_failure"],"normalized_score":67.5,"capped_score":67.5,"overall_status":"fail","overall_reason":"The passage violates the timing gate by making allocation after the orders are observed.","higher_than_both_justification":null}
