{"schema_version":"3.0.0","case_id":"C10b9445584d58e6f","judge_id":"judge_a","rubric_version":"3.0.0-rc.1","passage_function_interpretation":"model_setting","category_results":{"fidelity":{"applicability":"required","assessment_status":"assessed","score":4,"reason":"The capacity planner is replaced by an outside observer who does not control the capacity and recourse decision.","evidence_spans":["an outside observer who does not control the decision chooses first-stage capacity and a recourse policy"]},"managerial_framing":{"applicability":"optional","assessment_status":"assessed","score":12,"reason":"The timing, mechanism, stakes, and trade-off are concrete, but no responsible decision maker owns the choice as written.","evidence_spans":["an outside observer who does not control the decision","More advance capacity is expensive but reduces shortage"]},"scholarly_positioning":{"applicability":"optional","assessment_status":"assessed","score":17,"reason":"The contribution is conditional, specific, and bounded to the modeled distribution and recourse set.","evidence_spans":["isolates when flexible recourse substitutes for advance capacity"]},"evidence_discipline":{"applicability":"required","assessment_status":"assessed","score":14,"reason":"The passage clearly limits the findings to the modeled distribution and recourse set, though the actor contradicts context.","evidence_spans":["depend on the modeled distribution and recourse set rather than perfect demand foresight"]},"prose_clarity":{"applicability":"required","assessment_status":"assessed","score":9,"reason":"The prose remains concise and coherent apart from the substantive actor error.","evidence_spans":["First-stage capacity changes the feasible and costly adjustments available after demand realization"]}},"hard_failures":["actor_gate_failure"],"normalized_score":56,"capped_score":56,"overall_status":"fail","overall_reason":"The model sequence is otherwise strong, but a noncontrolling observer is incorrectly made the decision maker, failing the actor gate.","higher_than_both_justification":null}
