{"schema_version":"3.0.0","case_id":"C00059427eb898128","judge_id":"judge_b","rubric_version":"3.0.0-rc.1","passage_function_interpretation":"model_setting","category_results":{"fidelity":{"applicability":"required","assessment_status":"assessed","score":0,"reason":"It moves the first-stage decision until after future demand is fully observed, changing both timing and information.","evidence_spans":["after future demand by market has been fully observed"]},"managerial_framing":{"applicability":"required","assessment_status":"assessed","score":23,"reason":"The capacity-versus-recourse trade-off is otherwise concrete.","evidence_spans":["More advance capacity is expensive but reduces shortage"]},"scholarly_positioning":{"applicability":"required","assessment_status":"assessed","score":17,"reason":"It states a bounded recourse-substitution contribution.","evidence_spans":["flexible recourse substitutes for advance capacity"]},"evidence_discipline":{"applicability":"required","assessment_status":"assessed","score":15,"reason":"It explicitly limits findings to the modeled distribution and recourse set.","evidence_spans":["depend on the modeled distribution and recourse set"]},"prose_clarity":{"applicability":"required","assessment_status":"assessed","score":9,"reason":"The prose is concise and coherent despite the fidelity defect.","evidence_spans":["First-stage capacity changes the feasible"]}},"hard_failures":["timing_gate_failure","information_gate_failure"],"normalized_score":64,"capped_score":64,"overall_status":"fail","overall_reason":"The decision occurs after uncertainty is resolved, contradicting the first-stage model.","higher_than_both_justification":null}
