{"schema_version":"3.0.0","case_id":"C45c38522525c0616","judge_id":"judge_b","rubric_version":"3.0.0-rc.1","passage_function_interpretation":"model_setting","category_results":{"fidelity":{"applicability":"required","assessment_status":"assessed","score":0,"reason":"The routing decision is assigned to an outside observer who does not control it.","evidence_spans":["an outside observer who does not control the decision selects a feasible routing plan"]},"managerial_framing":{"applicability":"optional","assessment_status":"assessed","score":12,"reason":"The deadline trade-off is concrete, but the responsible decision maker is wrong.","evidence_spans":["Longer search may improve cost but can make the certified plan operationally late"]},"scholarly_positioning":{"applicability":"optional","assessment_status":"assessed","score":18,"reason":"It identifies a specific connection between certificate timing and release choice.","evidence_spans":["connects solution quality and certificate timing to the actual release decision"]},"evidence_discipline":{"applicability":"required","assessment_status":"assessed","score":15,"reason":"The computational claim is appropriately bounded.","evidence_spans":["limited to tested instances, hardware, and the specified deadline"]},"prose_clarity":{"applicability":"required","assessment_status":"assessed","score":9,"reason":"The prose is coherent and compact.","evidence_spans":["The algorithm trades additional search time for better incumbents and stronger bounds"]}},"hard_failures":["actor_gate_failure"],"normalized_score":54,"capped_score":54,"overall_status":"fail","overall_reason":"The actor who makes the routing decision fails the fidelity gate.","higher_than_both_justification":null}
